{
  "task_id": "W3-ORC-20261011-250815032831078487286239035365302936005",
  "type": "REPORT",
  "priority": "NORMAL",
  "origin": {
    "module": "ChatGPT",
    "tier": 1
  },
  "payload": {
    "owner_log": "repo_events/origin_agents/ChatGPT/logs/8489be8f27f34dfb8d7beaad3b9c232c.json"
  },
  "source_id": "repo_events/origin_agents/ChatGPT/logs/8489be8f27f34dfb8d7beaad3b9c232c.json",
  "created_at": "2026-10-25T01:17:18.659556Z",
  "updated_at": "2026-10-25T01:17:18.697162Z",
  "status": "COMPLETED",
  "destination": {
    "module": "Gemini"
  },
  "route": [
    {
      "destination": {
        "module": "Gemini"
      },
      "at": "2026-10-25T01:17:18.679004Z",
      "notification": "repo_events/origin_agents/ChatGPT/collaboration/W3-ORC-20261011-250815032831078487286239035365302936005-partner.json"
    }
  ],
  "history": [
    {
      "at": "2026-10-25T01:17:18.659556Z",
      "event": "RECEIVED",
      "actor": "ChatGPT",
      "detail": "intake"
    },
    {
      "at": "2026-10-25T01:17:18.659597Z",
      "event": "INSPECTING",
      "actor": "Orchestration",
      "detail": "inspect Origin work receipt"
    },
    {
      "at": "2026-10-25T01:17:18.659613Z",
      "event": "QUEUED",
      "actor": "Orchestration",
      "detail": "select partner"
    },
    {
      "at": "2026-10-25T01:17:18.679020Z",
      "event": "ROUTED",
      "actor": "Orchestration",
      "detail": "handoff delivered"
    },
    {
      "at": "2026-10-25T01:17:18.679031Z",
      "event": "ACKNOWLEDGED",
      "actor": "Gemini",
      "detail": "repository receipt inspected"
    },
    {
      "at": "2026-10-25T01:17:18.679039Z",
      "event": "IN_PROGRESS",
      "actor": "Gemini",
      "detail": "inspect evidence and unresolved work"
    },
    {
      "at": "2026-10-25T01:17:18.697137Z",
      "event": "VERIFYING",
      "actor": "Orchestration",
      "detail": "review report persisted"
    },
    {
      "at": "2026-10-25T01:17:18.697162Z",
      "event": "COMPLETED",
      "actor": "Orchestration",
      "detail": "report delivered; repairs remain separate"
    }
  ],
  "evidence": [
    {
      "at": "2026-10-25T01:17:18.679020Z",
      "ref": "repo_events/origin_agents/ChatGPT/collaboration/W3-ORC-20261011-250815032831078487286239035365302936005-partner.json",
      "actor": "Orchestration"
    },
    {
      "at": "2026-10-25T01:17:18.679031Z",
      "ref": "repo_events/origin_agents/ChatGPT/collaboration/W3-ORC-20261011-250815032831078487286239035365302936005-partner.json",
      "actor": "Gemini"
    },
    {
      "at": "2026-10-25T01:17:18.697137Z",
      "ref": "repo_events/origin_agents/ChatGPT/collaboration/W3-ORC-20261011-250815032831078487286239035365302936005-review.json",
      "actor": "Orchestration"
    }
  ],
  "blocker": null,
  "support": [],
  "human_review_required": false,
  "human_approval": null,
  "mutated": false,
  "completed_at": "2026-10-25T01:17:18.697162Z"
}