{
  "task_id": "W3-ORC-20261011-254277258878941106750002446842236109244",
  "type": "REPORT",
  "priority": "NORMAL",
  "origin": {
    "module": "ChatGPT",
    "tier": 1
  },
  "payload": {
    "owner_log": "repo_events/origin_agents/ChatGPT/logs/05ac036fc8dd425091c78cb3df4baef9.json"
  },
  "source_id": "repo_events/origin_agents/ChatGPT/logs/05ac036fc8dd425091c78cb3df4baef9.json",
  "created_at": "2026-10-25T17:16:29.227827Z",
  "updated_at": "2026-10-25T17:16:29.231012Z",
  "status": "BLOCKED",
  "destination": {
    "module": "Orchestration"
  },
  "route": [
    {
      "destination": {
        "module": "Orchestration"
      },
      "at": "2026-10-25T17:16:29.228657Z",
      "notification": "repo_events/origin_agents/ChatGPT/collaboration/W3-ORC-20261011-254277258878941106750002446842236109244-partner.json"
    }
  ],
  "history": [
    {
      "at": "2026-10-25T17:16:29.227827Z",
      "event": "RECEIVED",
      "actor": "ChatGPT",
      "detail": "intake"
    },
    {
      "at": "2026-10-25T17:16:29.227881Z",
      "event": "INSPECTING",
      "actor": "Orchestration",
      "detail": "inspect Origin work receipt"
    },
    {
      "at": "2026-10-25T17:16:29.227893Z",
      "event": "QUEUED",
      "actor": "Orchestration",
      "detail": "select partner"
    },
    {
      "at": "2026-10-25T17:16:29.228672Z",
      "event": "ROUTED",
      "actor": "Orchestration",
      "detail": "handoff delivered"
    },
    {
      "at": "2026-10-25T17:16:29.228681Z",
      "event": "ACKNOWLEDGED",
      "actor": "Orchestration",
      "detail": "repository receipt inspected"
    },
    {
      "at": "2026-10-25T17:16:29.228689Z",
      "event": "IN_PROGRESS",
      "actor": "Orchestration",
      "detail": "inspect evidence and unresolved work"
    },
    {
      "at": "2026-10-25T17:16:29.228704Z",
      "event": "BLOCKED",
      "actor": "Orchestration",
      "detail": "owner_work_incomplete"
    },
    {
      "at": "2026-10-25T17:16:29.228720Z",
      "event": "ASSISTING",
      "actor": "Orchestration",
      "detail": "TOOL:W3 repository tools support"
    },
    {
      "at": "2026-10-25T17:16:29.231012Z",
      "event": "BLOCKED",
      "actor": "Orchestration",
      "detail": "blocker remains"
    }
  ],
  "evidence": [
    {
      "at": "2026-10-25T17:16:29.228672Z",
      "ref": "repo_events/origin_agents/ChatGPT/collaboration/W3-ORC-20261011-254277258878941106750002446842236109244-partner.json",
      "actor": "Orchestration"
    },
    {
      "at": "2026-10-25T17:16:29.228681Z",
      "ref": "repo_events/origin_agents/ChatGPT/collaboration/W3-ORC-20261011-254277258878941106750002446842236109244-partner.json",
      "actor": "Orchestration"
    },
    {
      "at": "2026-10-25T17:16:29.231012Z",
      "ref": "repo_events/origin_agents/ChatGPT/collaboration/W3-ORC-20261011-254277258878941106750002446842236109244-support.json",
      "actor": "Orchestration"
    }
  ],
  "blocker": {
    "kind": "owner_work_incomplete",
    "owner_log": "repo_events/origin_agents/ChatGPT/logs/05ac036fc8dd425091c78cb3df4baef9.json",
    "reason": "IDP/ENV does not grant read: protocol/mpcp/runtime/README.md"
  },
  "support": [
    {
      "kind": "TOOL",
      "name": "W3 repository tools support",
      "result": {
        "resolved": false,
        "evidence": "repo_events/origin_agents/ChatGPT/collaboration/W3-ORC-20261011-254277258878941106750002446842236109244-support.json",
        "diagnostics": {
          "tool": "W3 repository tools support",
          "owner": "ChatGPT",
          "owner_status": "FAILED",
          "owner_log": "repo_events/origin_agents/ChatGPT/logs/05ac036fc8dd425091c78cb3df4baef9.json",
          "checks": [
            {
              "check": "owner_receipt",
              "path": "repo_events/origin_agents/ChatGPT/logs/05ac036fc8dd425091c78cb3df4baef9.json",
              "state": "EVIDENCED",
              "sha256": "64a54e2953a94e43b4591b8c8a9f1e873459867d4bfbc609de73cda35174827d"
            }
          ],
          "findings": [],
          "tools_used": [],
          "owner_reason": "IDP/ENV does not grant read: protocol/mpcp/runtime/README.md",
          "resolved": false,
          "next_steps": [
            "Inspect the recorded owner error and affected paths.",
            "Return corrected work to the Origin owner; repairs from review require BBX19 selection."
          ],
          "source_mutated": false,
          "unknowns": [
            "Checks verify recorded file outcomes, not all role semantics or external systems."
          ]
        }
      },
      "at": "2026-10-25T17:16:29.230992Z"
    }
  ],
  "human_review_required": false,
  "human_approval": null,
  "mutated": false,
  "completed_at": null
}